{
  "schema_version": "1.0.0",
  "contract_id": "mcp-run-ci-optimized",
  "tool_name": "run-ci-optimized",
  "description": "Local CI execution with parallel processing, smart caching, and performance optimization",
  "executable": "scripts/run-ci-optimized.sh",
  "language": "bash",
  "capabilities": [
    "parallel_test_execution",
    "smart_dependency_caching",
    "conditional_test_execution",
    "performance_monitoring",
    "legacy_compatibility_mode"
  ],
  "parameters": {
    "required": [],
    "properties": {
      "mode": {
        "type": "string",
        "description": "CI execution mode",
        "enum": ["fast", "full", "parallel", "benchmark"],
        "default": "parallel"
      },
      "cache": {
        "type": "boolean",
        "description": "Enable dependency caching",
        "default": true
      },
      "verbose": {
        "type": "boolean",
        "description": "Enable verbose output",
        "default": false
      }
    }
  },
  "security": {
    "input_sanitization": true,
    "command_injection_protection": true,
    "timeout_enforcement": true,
    "privilege_isolation": false,
    "output_sanitization": true
  },
  "usage_examples": [
    "./scripts/run-ci-optimized.sh fast",
    "./scripts/run-ci-optimized.sh parallel --verbose",
    "./scripts/run-ci-optimized.sh benchmark --no-cache"
  ],
  "created_date": "2025-07-25",
  "last_modified": "2025-07-25",
  "status": "active"
}
